{
  "artifactId": "artifact-contribution-1",
  "workerId": "worker-research-a",
  "assignmentId": "assignment-research-a",
  "attemptId": "attempt-research-a-1",
  "inputBinding": "sha256:example-input-binding",
  "kind": "contribution",
  "schemaRef": "urn:example:schema:research-contribution",
  "data": {
    "recommendation": "Reconcile external state before retry.",
    "risks": [
      "Blind retry can duplicate side effects."
    ]
  },
  "evidence": [
    {
      "uri": "urn:example:source:architecture-note",
      "label": "Architecture evidence"
    }
  ]
}
