{
  "artifactId": "artifact-completion-1",
  "workerId": "worker-research-a",
  "assignmentId": "assignment-research-a",
  "attemptId": "attempt-research-a-1",
  "inputBinding": "sha256:example-input-binding",
  "kind": "completion",
  "schemaRef": "urn:example:schema:research-final",
  "data": {
    "recommendation": "Use reconciliation-before-retry for uncertain external effects.",
    "unresolvedVerification": []
  }
}
